{
  "version": "2.0.0",
  "generated_at": "2026-06-04T10:55:09.478Z",
  "fallback": "route.meta-system.supreme-router",
  "routes": {
    "help": "route.meta-system.supreme-router",
    "route": "route.meta-system.supreme-router",
    "ai bias audit": "route.data-ai.ai-ethics-specialist",
    "fairness assessment": "route.data-ai.ai-ethics-specialist",
    "ai ethics review": "route.data-ai.ai-ethics-specialist",
    "model transparency check": "route.data-ai.ai-ethics-specialist",
    "responsible ai evaluation": "route.data-ai.ai-ethics-specialist",
    "ai product strategy": "route.data-ai.ai-product-manager",
    "ml project prioritization": "route.data-ai.ai-product-manager",
    "ai feature planning": "route.data-ai.ai-product-manager",
    "ai roadmap design": "route.data-ai.ai-product-manager",
    "ml business case": "route.data-ai.ai-product-manager",
    "ai research experiment": "route.data-ai.ai-research-scientist",
    "novel architecture design": "route.data-ai.ai-research-scientist",
    "training method research": "route.data-ai.ai-research-scientist",
    "ai theory analysis": "route.data-ai.ai-research-scientist",
    "research paper reproduction": "route.data-ai.ai-research-scientist",
    "analytics engineering": "route.data-ai.analytics-engineer",
    "dbt pipeline": "route.data-ai.analytics-engineer",
    "analytics engineer task": "route.data-ai.analytics-engineer",
    "analytics engineer dbt model review": "route.data-ai.analytics-engineer",
    "analytics engineer data mart design": "route.data-ai.analytics-engineer",
    "analytics engineer incremental model strategy": "route.data-ai.analytics-engineer",
    "analytics engineer test and documentation plan": "route.data-ai.analytics-engineer",
    "bi dashboard build": "route.data-ai.bi-developer",
    "olap cube design": "route.data-ai.bi-developer",
    "bi platform setup": "route.data-ai.bi-developer",
    "self service analytics": "route.data-ai.bi-developer",
    "bi report development": "route.data-ai.bi-developer",
    "image classification model": "route.data-ai.computer-vision-engineer",
    "object detection setup": "route.data-ai.computer-vision-engineer",
    "visual search system": "route.data-ai.computer-vision-engineer",
    "image segmentation pipeline": "route.data-ai.computer-vision-engineer",
    "computer vision pipeline": "route.data-ai.computer-vision-engineer",
    "data analysis report": "route.data-ai.data-analyst",
    "business metrics analysis": "route.data-ai.data-analyst",
    "data visualization": "route.data-ai.data-analyst",
    "kpi dashboard design": "route.data-ai.data-analyst",
    "ad hoc data query": "route.data-ai.data-analyst",
    "data pipeline build": "route.data-ai.data-engineer",
    "etl process design": "route.data-ai.data-engineer",
    "data ingestion setup": "route.data-ai.data-engineer",
    "data warehouse schema": "route.data-ai.data-engineer",
    "streaming pipeline": "route.data-ai.data-engineer",
    "data science analysis": "route.data-ai.data-scientist",
    "statistical modeling": "route.data-ai.data-scientist",
    "exploratory data analysis": "route.data-ai.data-scientist",
    "build predictive model": "route.data-ai.data-scientist",
    "data insight extraction": "route.data-ai.data-scientist",
    "eval harness": "route.data-ai.eval-engineer",
    "regression eval": "route.data-ai.eval-engineer",
    "agent eval suite": "route.data-ai.eval-engineer",
    "llm regression test": "route.data-ai.eval-engineer",
    "eval fixtures build": "route.data-ai.eval-engineer",
    "graph rag implementation": "route.data-ai.graph-rag-engineer",
    "knowledge graph retrieval": "route.data-ai.graph-rag-engineer",
    "graph augmented rag": "route.data-ai.graph-rag-engineer",
    "community detection rag": "route.data-ai.graph-rag-engineer",
    "entity graph build": "route.data-ai.graph-rag-engineer",
    "fine tune llm": "route.data-ai.llm-fine-tuner",
    "lora fine tuning": "route.data-ai.llm-fine-tuner",
    "llm domain adaptation": "route.data-ai.llm-fine-tuner",
    "instruction tuning": "route.data-ai.llm-fine-tuner",
    "model alignment": "route.data-ai.llm-fine-tuner",
    "evaluate our model on a held-out set with model evaluation": "route.data-ai.master",
    "build a rag pipeline for our docs": "route.data-ai.master",
    "data engineering": "route.data-ai.master",
    "machine learning": "route.data-ai.master",
    "rag pipeline": "route.data-ai.master",
    "model evaluation": "route.data-ai.master",
    "data analytics": "route.data-ai.master",
    "fine tune model": "route.data-ai.ml-engineer",
    "model training": "route.data-ai.ml-engineer",
    "ml inference setup": "route.data-ai.ml-engineer",
    "ml model serving": "route.data-ai.ml-engineer",
    "ml pipeline build": "route.data-ai.ml-engineer",
    "mlops pipeline setup": "route.data-ai.mlops-engineer",
    "model ci cd": "route.data-ai.mlops-engineer",
    "feature store design": "route.data-ai.mlops-engineer",
    "model registry management": "route.data-ai.mlops-engineer",
    "ml deployment automation": "route.data-ai.mlops-engineer",
    "text classification model": "route.data-ai.nlp-engineer",
    "named entity recognition": "route.data-ai.nlp-engineer",
    "sentiment analysis pipeline": "route.data-ai.nlp-engineer",
    "nlp system design": "route.data-ai.nlp-engineer",
    "language model fine tuning": "route.data-ai.nlp-engineer",
    "prompt design": "route.data-ai.prompt-engineer",
    "prompt optimization": "route.data-ai.prompt-engineer",
    "llm prompt engineering": "route.data-ai.prompt-engineer",
    "prompt template creation": "route.data-ai.prompt-engineer",
    "prompt testing": "route.data-ai.prompt-engineer",
    "rag implementation": "route.data-ai.rag-engineer",
    "vector search setup": "route.data-ai.rag-engineer",
    "embedding pipeline": "route.data-ai.rag-engineer",
    "chunking strategy": "route.data-ai.rag-engineer",
    "retrieval augmented generation": "route.data-ai.rag-engineer",
    "recommendation system design": "route.data-ai.recommendation-engineer",
    "collaborative filtering setup": "route.data-ai.recommendation-engineer",
    "content based recommendation": "route.data-ai.recommendation-engineer",
    "personalization engine": "route.data-ai.recommendation-engineer",
    "recommendation eval": "route.data-ai.recommendation-engineer",
    "accessibility audit": "route.design-content.accessibility-auditor",
    "wcag check pass": "route.design-content.accessibility-auditor",
    "keyboard nav review": "route.design-content.accessibility-auditor",
    "screen reader audit": "route.design-content.accessibility-auditor",
    "color contrast review": "route.design-content.accessibility-auditor",
    "wcag 22 compliance check for the app": "route.design-content.accessibility-auditor",
    "inclusive design review for the signup flow": "route.design-content.accessibility-auditor",
    "a11y remediation plan for the navigation": "route.design-content.accessibility-auditor",
    "screen reader testing for the data table": "route.design-content.accessibility-auditor",
    "visual identity refresh for the platform": "route.design-content.brand-designer",
    "brand application design for social media": "route.design-content.brand-designer",
    "brand guidelines creation for the company": "route.design-content.brand-designer",
    "logo design system for the product": "route.design-content.brand-designer",
    "brand identity design for the new startup": "route.design-content.brand-designer",
    "brand identity design": "route.design-content.brand-designer",
    "logo design system": "route.design-content.brand-designer",
    "brand guidelines creation": "route.design-content.brand-designer",
    "brand application design": "route.design-content.brand-designer",
    "visual identity refresh": "route.design-content.brand-designer",
    "brand strategy design": "route.design-content.brand-strategist",
    "visual identity system": "route.design-content.brand-strategist",
    "brand architecture plan": "route.design-content.brand-strategist",
    "brand voice guide": "route.design-content.brand-strategist",
    "brand positioning": "route.design-content.brand-strategist",
    "brand strategy": "route.design-content.brand-strategist",
    "grammar and clarity edit for the whitepaper": "route.design-content.content-editor",
    "tone consistency review across all pages": "route.design-content.content-editor",
    "style guide compliance check on the docs": "route.design-content.content-editor",
    "copy review and refinement for the homepage": "route.design-content.content-editor",
    "editing pass on the blog post draft": "route.design-content.content-editor",
    "content editing pass": "route.design-content.content-editor",
    "copy review and refinement": "route.design-content.content-editor",
    "style guide compliance check": "route.design-content.content-editor",
    "tone consistency review": "route.design-content.content-editor",
    "grammar and clarity edit": "route.design-content.content-editor",
    "audience content mapping for new segments": "route.design-content.content-strategist",
    "content governance framework for the team": "route.design-content.content-strategist",
    "editorial calendar for q3 publishing": "route.design-content.content-strategist",
    "content audit for the help documentation": "route.design-content.content-strategist",
    "develop a content strategy for the blog": "route.design-content.content-strategist",
    "content strategy plan": "route.design-content.content-strategist",
    "content audit analysis": "route.design-content.content-strategist",
    "editorial calendar design": "route.design-content.content-strategist",
    "content governance framework": "route.design-content.content-strategist",
    "audience content mapping": "route.design-content.content-strategist",